{
  "call_id": "01-text_minimal",
  "lab": "gemini-vlm",
  "experiment": "text_minimal",
  "mode": "live",
  "provider": "gemini",
  "endpoint": "(not called)",
  "model": "(no model)",
  "prompt_id": null,
  "request": {
    "boundary_hash": "d6d8ee7537cf1ba2eec44827f297c69d44bc7df68fe32997492be9781cad5d4c",
    "text_parts": [],
    "image_parts": [],
    "response_schema_sent": null,
    "generation_config": null
  },
  "outcome": {
    "status": "unavailable",
    "http_status": null,
    "finish_reason": null,
    "safety_blocked": null,
    "text": null,
    "json": null,
    "json_valid_against_schema": null,
    "schema_errors": [],
    "error_type": null,
    "error_message": "GEMINI_API_KEY is not set"
  },
  "telemetry": {
    "latency_ms": null,
    "usage": null,
    "model_version_reported": null,
    "retry_after_s": null,
    "rate_limited": null
  },
  "epistemic": {
    "status": "interpretive",
    "measured": false,
    "supported_by_capability": null,
    "prompt_carries_user_claim": null,
    "note": "no call was made; nothing was observed"
  },
  "corpus_invariant": null,
  "captured_at": null,
  "content_hash": "cbaf8694c2684a652441d32410b3747a1666b493efa262335b9d5328263517a3"
}
